{
  "schemaVersion": 2,
  "meta": {
    "generatedAt": "2026-06-05T11:03:30.715260Z",
    "apiBase": "https://www.tellusxdp.com/api/traveler/v1",
    "templateId": "airport",
    "industry": "空港監視",
    "industryIcon": "🛬",
    "pitch": "滑走路・誘導路周辺の地盤沈下を mm 単位で長期トレンド分析",
    "datasetsCatalog": [
      {
        "id": "1a41a4b1-4594-431f-95fb-82f9bdc35d6b",
        "name": "PALSAR-2 L2.1 GeoTIFF",
        "description": "L-band SAR, 3m GSD",
        "observationCount": 0
      },
      {
        "id": "b0e16dea-6544-4422-926f-ad3ec9a3fcbd",
        "name": "PALSAR-2 ScanSAR",
        "description": "L-band wide-swath SAR, 25m",
        "observationCount": 0
      },
      {
        "id": "57233372-b507-4611-9c1f-bfd973a2fce6",
        "name": "ALOS-2 Spotlight",
        "description": "L-band SAR, 1m GSD",
        "observationCount": 0
      }
    ],
    "tellusPortalUrl": "https://www.tellusxdp.com/",
    "disclaimer": "本テンプレの観測値は合成データです (synthesized)。Tellus dataset ID は実在しますが、個別シーンメタは 本デモのために決定論的に生成しています。"
  },
  "qualityReport": {
    "overallScore": 0.78,
    "totalObservations": 16,
    "regionsWithGeometry": 1,
    "regionsWithThumbnails": 1,
    "notes": [
      "空港監視 監視テンプレート (合成データ)",
      "対象期間: 2016-01 〜 2024-01",
      "サムネイルはバンドル済み合成 PNG (bundled_demo_png)",
      "実運用ではこのスキーマに本物の Tellus 取得結果を流し込む"
    ]
  },
  "coverageByYear": {
    "toyama_airport": {
      "2016": 2,
      "2017": 2,
      "2018": 2,
      "2019": 2,
      "2020": 2,
      "2021": 2,
      "2022": 2,
      "2023": 1,
      "2024": 1
    }
  },
  "regions": {
    "toyama_airport": {
      "id": "toyama_airport",
      "name": "富山空港",
      "type": "airport",
      "infrastructureType": "airport",
      "lat": 36.6483,
      "lon": 137.1875,
      "description": "滑走路・誘導路周辺の地盤沈下を mm 単位で長期トレンド分析",
      "observationCount": 16,
      "observations": [
        {
          "dataId": "e86b4a5b-4bc9-bdd3-0ee3-b01b60a56b28",
          "datasetId": "1a41a4b1-4594-431f-95fb-82f9bdc35d6b",
          "acquisitionDate": "2016-01-15",
          "start_datetime": "2016-01-15T00:00:00Z",
          "orbitDirection": "ascending",
          "polarization": "HH",
          "relativeOrbit": 100,
          "offNadir": 33.98,
          "monitoringIndex": 0.571,
          "geometry": {
            "type": "Polygon",
            "coordinates": [
              [
                [
                  137.09766980841508,
                  36.576227927927924
                ],
                [
                  137.27733019158492,
                  36.576227927927924
                ],
                [
                  137.27733019158492,
                  36.720372072072074
                ],
                [
                  137.09766980841508,
                  36.720372072072074
                ],
                [
                  137.09766980841508,
                  36.576227927927924
                ]
              ]
            ]
          },
          "thumbnailUrl": "assets/images/templates/cached/airport/e86b4a5b-4bc9-bdd3-0ee3-b01b60a56b28.png",
          "qualityScore": 0.594
        },
        {
          "dataId": "2833001b-6b88-0425-f1cf-a88b1fdf7278",
          "datasetId": "b0e16dea-6544-4422-926f-ad3ec9a3fcbd",
          "acquisitionDate": "2016-07-27",
          "start_datetime": "2016-07-27T00:00:00Z",
          "orbitDirection": "descending",
          "polarization": "HH+HV",
          "relativeOrbit": 117,
          "offNadir": 29.64,
          "monitoringIndex": 0.437,
          "geometry": {
            "type": "Polygon",
            "coordinates": [
              [
                [
                  137.09766980841508,
                  36.576227927927924
                ],
                [
                  137.27733019158492,
                  36.576227927927924
                ],
                [
                  137.27733019158492,
                  36.720372072072074
                ],
                [
                  137.09766980841508,
                  36.720372072072074
                ],
                [
                  137.09766980841508,
                  36.576227927927924
                ]
              ]
            ]
          },
          "thumbnailUrl": "assets/images/templates/cached/airport/2833001b-6b88-0425-f1cf-a88b1fdf7278.png",
          "qualityScore": 0.91
        },
        {
          "dataId": "55113bdb-f84c-d5c8-57b8-3258fe529a76",
          "datasetId": "57233372-b507-4611-9c1f-bfd973a2fce6",
          "acquisitionDate": "2017-02-07",
          "start_datetime": "2017-02-07T00:00:00Z",
          "orbitDirection": "ascending",
          "polarization": "HH+HV",
          "relativeOrbit": 134,
          "offNadir": 33.07,
          "monitoringIndex": 0.568,
          "geometry": {
            "type": "Polygon",
            "coordinates": [
              [
                [
                  137.09766980841508,
                  36.576227927927924
                ],
                [
                  137.27733019158492,
                  36.576227927927924
                ],
                [
                  137.27733019158492,
                  36.720372072072074
                ],
                [
                  137.09766980841508,
                  36.720372072072074
                ],
                [
                  137.09766980841508,
                  36.576227927927924
                ]
              ]
            ]
          },
          "thumbnailUrl": "assets/images/templates/airport/55113bdb-f84c-d5c8-57b8-3258fe529a76.png",
          "qualityScore": 0.731
        },
        {
          "dataId": "81a6cd14-4465-9b00-01ab-4ee44dde28a7",
          "datasetId": "1a41a4b1-4594-431f-95fb-82f9bdc35d6b",
          "acquisitionDate": "2017-08-21",
          "start_datetime": "2017-08-21T00:00:00Z",
          "orbitDirection": "descending",
          "polarization": "HH",
          "relativeOrbit": 151,
          "offNadir": 26.96,
          "monitoringIndex": 0.591,
          "geometry": {
            "type": "Polygon",
            "coordinates": [
              [
                [
                  137.09766980841508,
                  36.576227927927924
                ],
                [
                  137.27733019158492,
                  36.576227927927924
                ],
                [
                  137.27733019158492,
                  36.720372072072074
                ],
                [
                  137.09766980841508,
                  36.720372072072074
                ],
                [
                  137.09766980841508,
                  36.576227927927924
                ]
              ]
            ]
          },
          "thumbnailUrl": "assets/images/templates/cached/airport/81a6cd14-4465-9b00-01ab-4ee44dde28a7.png",
          "qualityScore": 0.746
        },
        {
          "dataId": "bd322ed4-f0fe-5350-422e-95cb52436b90",
          "datasetId": "b0e16dea-6544-4422-926f-ad3ec9a3fcbd",
          "acquisitionDate": "2018-03-03",
          "start_datetime": "2018-03-03T00:00:00Z",
          "orbitDirection": "ascending",
          "polarization": "HH+HV",
          "relativeOrbit": 168,
          "offNadir": 33.12,
          "monitoringIndex": 0.728,
          "geometry": {
            "type": "Polygon",
            "coordinates": [
              [
                [
                  137.09766980841508,
                  36.576227927927924
                ],
                [
                  137.27733019158492,
                  36.576227927927924
                ],
                [
                  137.27733019158492,
                  36.720372072072074
                ],
                [
                  137.09766980841508,
                  36.720372072072074
                ],
                [
                  137.09766980841508,
                  36.576227927927924
                ]
              ]
            ]
          },
          "thumbnailUrl": "assets/images/templates/cached/airport/bd322ed4-f0fe-5350-422e-95cb52436b90.png",
          "qualityScore": 0.594
        },
        {
          "dataId": "412d75a2-c6ca-8273-c969-be0f281dce85",
          "datasetId": "57233372-b507-4611-9c1f-bfd973a2fce6",
          "acquisitionDate": "2018-09-14",
          "start_datetime": "2018-09-14T00:00:00Z",
          "orbitDirection": "descending",
          "polarization": "HH+HV",
          "relativeOrbit": 185,
          "offNadir": 25.6,
          "monitoringIndex": 0.423,
          "geometry": {
            "type": "Polygon",
            "coordinates": [
              [
                [
                  137.09766980841508,
                  36.576227927927924
                ],
                [
                  137.27733019158492,
                  36.576227927927924
                ],
                [
                  137.27733019158492,
                  36.720372072072074
                ],
                [
                  137.09766980841508,
                  36.720372072072074
                ],
                [
                  137.09766980841508,
                  36.576227927927924
                ]
              ]
            ]
          },
          "thumbnailUrl": "assets/images/templates/airport/412d75a2-c6ca-8273-c969-be0f281dce85.png",
          "qualityScore": 0.66
        },
        {
          "dataId": "258de4fc-a559-e0e3-bf2e-2d9d33660afe",
          "datasetId": "1a41a4b1-4594-431f-95fb-82f9bdc35d6b",
          "acquisitionDate": "2019-03-28",
          "start_datetime": "2019-03-28T00:00:00Z",
          "orbitDirection": "ascending",
          "polarization": "HH",
          "relativeOrbit": 202,
          "offNadir": 34.46,
          "monitoringIndex": 0.647,
          "geometry": {
            "type": "Polygon",
            "coordinates": [
              [
                [
                  137.09766980841508,
                  36.576227927927924
                ],
                [